commissioner;category;persons;date;year;month;day;met_with;subject;link
Jourova_cabinet;cabinet;Marie Frenay;03.04.2023;2023.0;4.0;3.0;Svaz českých knihkupců a nakladatelů, zapsaný spolek;European Media Freedom Act;https://ec.europa.eu/transparencyregister/public/consultation/displaylobbyist.do?id=293171528851-04
Jourova_cabinet;cabinet;Marie Frenay;12.04.2023;2023.0;4.0;12.0;EU DisinfoLab;European Media Freedom Act;https://ec.europa.eu/transparencyregister/public/consultation/displaylobbyist.do?id=593474530364-05
Jourova_cabinet;cabinet;Wojtek Talko;13.04.2023;2023.0;4.0;13.0;Access Now Europe;Transparency of Political Advertising Regulation;https://ec.europa.eu/transparencyregister/public/consultation/displaylobbyist.do?id=241832823598-19
Jourova_cabinet;cabinet;Marie Frenay;20.04.2023;2023.0;4.0;20.0;ALLIANCE DE LA PRESSE D’INFORMATION GÉNÉRALE;European Media Freedom Act;https://ec.europa.eu/transparencyregister/public/consultation/displaylobbyist.do?id=917249537939-70
Jourova_cabinet;cabinet;Marie Frenay;20.04.2023;2023.0;4.0;20.0;Agence France-Presse;European Media Freedom Act;https://ec.europa.eu/transparencyregister/public/consultation/displaylobbyist.do?id=076448128904-35
Hahn_cabinet;cabinet;Maximilian Strotmann;20.04.2023;2023.0;4.0;20.0;Access Partnership;Interoperability;https://ec.europa.eu/transparencyregister/public/consultation/displaylobbyist.do?id=467615113800-87
Jourova_cabinet;cabinet;Wojtek Talko, Simona Constantin;24.04.2023;2023.0;4.0;24.0;European Partnership for Democracy;Defence of Democracy, Foreign interference initiative;https://ec.europa.eu/transparencyregister/public/consultation/displaylobbyist.do?id=679535014238-83
Jourova_cabinet;cabinet;Marie Frenay;25.04.2023;2023.0;4.0;25.0;Conde Nast Holdings Limited;European Media Freedom Act, European Digital Pulishers;https://ec.europa.eu/transparencyregister/public/consultation/displaylobbyist.do?id=411131044251-94
Suica;commissioner;nan;25.04.2023;2023.0;4.0;25.0;The LEGO Group;The implementation of the EU Strategy on the rights of the child;https://ec.europa.eu/transparencyregister/public/consultation/displaylobbyist.do?id=236869539281-13
Jourova;commissioner;nan;26.04.2023;2023.0;4.0;26.0;Committee to Protect Journalists;Discuss findings of their latest report;https://ec.europa.eu/transparencyregister/public/consultation/displaylobbyist.do?id=370649919011-72
Jourova_cabinet;cabinet;Alvaro De Elera;26.04.2023;2023.0;4.0;26.0;VEP S.R.L.;Sanction violations within the EU;https://ec.europa.eu/transparencyregister/public/consultation/displaylobbyist.do?id=874095448041-73
Jourova_cabinet;cabinet;Marie Frenay, Daniel Braun;26.04.2023;2023.0;4.0;26.0;The Danish Chamber of Commerce;Digital and democracy agenda;https://ec.europa.eu/transparencyregister/public/consultation/displaylobbyist.do?id=0330934426-12
Jourova_cabinet;cabinet;Marie Frenay;26.04.2023;2023.0;4.0;26.0;Committee to Protect Journalists;Discuss findings of their latest report;https://ec.europa.eu/transparencyregister/public/consultation/displaylobbyist.do?id=370649919011-72
Schmit;commissioner;nan;27.04.2023;2023.0;4.0;27.0;Zentralverband des Deutschen Handwerks e.V.;European Year of Skills, promotion of Vocational Education and Training, apprenticeships and dual education, as well as employment in skilled crafts sector;https://ec.europa.eu/transparencyregister/public/consultation/displaylobbyist.do?id=5189667783-94
Schmit_cabinet;cabinet;Anouk Faber, Christoph Nerlich;27.04.2023;2023.0;4.0;27.0;Zentralverband des Deutschen Handwerks e.V.;European Year of Skills, promotion of Vocational Education and Training, apprenticeships and dual education, as well as employment in skilled crafts sector;https://ec.europa.eu/transparencyregister/public/consultation/displaylobbyist.do?id=5189667783-94
Schmit_cabinet;cabinet;Antoine Kasel;28.04.2023;2023.0;4.0;28.0;BUSINESSEUROPE;Preparation OSH Summit 15-16/05/2023;https://ec.europa.eu/transparencyregister/public/consultation/displaylobbyist.do?id=3978240953-79
